,floyd_stance,floyd_followup,username,date,text,hash
0,0,0,ADMupdates,5/5/20,"Especially now, access to nutrition has the power to solve many of the world’s challenges. On #GivingTuesday, we’re giving even more support to organizations across the world who provide hunger relief and fight on the front lines against #COVID. https://t.co/qszeMJ3k4Z https://t.co/Ui6XXPMkkU",h18246819314043943882
1,0,0,ADMupdates,5/6/20,ADM Directors Declare Cash Dividend https://t.co/CVZXDT06Ls https://t.co/09QXG9AZVG,h7669429277519101170
2,0,0,ADMupdates,5/7/20,"We’re proud Jeff Belcher is part of #TeamADM. A licensed paramedic, he’s taken temporary paid leave from his day job in maintenance at ADM to help save lives during the #coronavirus pandemic. Read his story: https://t.co/y1SWhXuxXy https://t.co/XDPxUPUWi1",h11604890982154687513
3,0,0,ADMupdates,5/11/20,"For many, being a working mom looks different right now. We're so thankful to the moms on #TeamADM for being fully committed to improving global nutrition and nourishing quality of life. Happy #MothersDay ! https://t.co/OlP084EnxD",h2049076336731789608
4,0,0,ADMupdates,5/13/20,"""You feel comforted and cocooned."" In an interview with @Inverse, ADM Chief Flavorist Marie Wright dives into the science behind #comfortfood and why we’re craving it right now: https://t.co/wNPjnxbgZ3 #icecream https://t.co/vEBYaAtPhn",h11694367689268620816
5,0,0,ADMupdates,5/13/20,"Hunger. For many, it’s been exacerbated by #covid19. This Friday, in a webinar with @Concern , ADM Chief Sustainability Officer Alison Taylor will explain how we can all be part of the solution. RSVP here: https://t.co/tXf3HEwsmn https://t.co/nDQltIkVM0",h5445141122821958794
6,0,0,ADMupdates,5/14/20,The health of our natural resources is critical to our future. ADM’s Alison Taylor tells @Greenbiz how our goals to curb greenhouse gas emissions and reduce energy intensity will create a stronger ADM and a better world: https://t.co/xsV4xIBSp5,h9214756835056267076
7,0,0,ADMupdates,5/14/20,"We're honored to support #HealthcareHeroes and provide access to nutrition worldwide. In Indonesia, #ADMCares partnered with @ACT_JaBar's to provide food, water &amp; medical &amp; cleaning supplies to those impacted by #COVID-19. https://t.co/C0LzV7OLeO",h12414057533401012339
8,0,0,ADMupdates,5/18/20,"Our investment in the R&amp;D of probiotics and their effectiveness has been
recognized with three prestigious awards from @NutraEurope. The winning
solutions were praised by judges for being “truly innovative” natural
probiotics ingredients. #NIAAwards20 https://t.co/m94dm1fFuN",h9585952740351525975
9,0,0,ADMupdates,5/19/20,"Today, we announced new goals to reduce water intensity by 10 percent and achieve a 90 percent landfill diversion rate by 2035. Our commitments to sustainable practices will result in a stronger ADM and a better world: https://t.co/UCouvDqIb5 https://t.co/Zulej0Cx7z",h15750973776498786204
10,0,0,ADMupdates,5/20/20,We're proud to partner with Dr. Cortés @GVAsagunt for a clinical trial into the effects of probiotic food supplements to improve health functions for COVID-19 patients in high-risk groups: https://t.co/xfN92veI2r https://t.co/BUWefLWGGG,h4484991347634291932
11,0,0,ADMupdates,5/27/20,"Introducing PlantPlus Foods, a new joint venture from @ADMupdates and @marfrig_mrfg3 offering plant-based meat alternatives for customers in North and South America. Learn more: https://t.co/nVBbIgSrxZ https://t.co/Jyl3Q4Bq2c",h2009474627644323016
12,1,0,ADMupdates,6/5/20,"We understand the urgency to act now. To promote substantive change, ADM will contribute $200,000 to the @NatUrbanLeague , an organization dedicated to advancing economic empowerment, equality and social justice for African Americans and others in underserved communities. https://t.co/oJWMz69vYh",h17593861644756343935
13,0,0,ADMupdates,6/5/20,"We believe in creating a positive impact on the world. That’s why earlier this year, we made aggressive new commitments to reduce greenhouse gas emissions, energy &amp; water intensity and landfill waste. Learn more: https://t.co/y9OMz2pEgW #WorldEnvironmentDay https://t.co/DcCPTYFxOu",h5464247031361403710
14,0,0,ADMupdates,6/8/20,"Next week, ADM CFO Ray Young will talk about ADM’s strategy and performance in a fireside chat in the @Stifel 2020 Virtual Cross Sector Insight Conference. Join the webcast live on Wed., June 10 at 9:20 ET at https://t.co/JM6984NJSX https://t.co/0c7NNAfT3f",h2015871471142449284
15,0,0,ADMupdates,6/9/20,"We’re proud to play a part, engaging farmers in Brazil’s Cerrado region for sustainable soy production. @WBCSD @Solidaridadnetw https://t.co/dx7fHCnh3Q",h16728494975715120022
16,0,0,ADMupdates,6/10/20,"We’re continuing to support #HealthcareHeroes . In the UK, ADM Protexin donated 9,000 samples of our Bio-Kult microbial food supplements to help support medical staff at the NHS by complementing their gut flora, at a time when they need it most. https://t.co/cFYwf0GR1k https://t.co/LbG6R5tQQJ",h3952069849553337608
17,0,0,AIGinsurance,5/4/20,"In the face of COVID-19, our colleagues have shown great resilience and remain focused on what we do best, which is helping our clients manage risk, especially in difficult times. Read our results and join tomorrow’s webcast at 8amET.",h13317239224893192718
18,0,0,AIGinsurance,5/4/20,"@dani_dseg Hi Dani, We apologize for the wait time since we are experiencing an extremely high volume of inquiries. You can check the status of your claim online at: https://t.co/D6BTtJA5Iq. If you need additional assistance, please call 1-800-826-1300. Thank you.",h10582444873507833613
19,0,0,AIGinsurance,5/4/20,"@jwmw729 Hi, Please call 1-800-826-1300 for additional assistance. Please check out our FAQs regarding COVID-19: https://t.co/FkosO0BKXl and use our self-service options: https://t.co/GOyyA8wOTa.  Thank you.",h17059434932478329265
20,0,0,AIGinsurance,5/4/20,"@PamelaGordon2 Hello Pamela, we are sorry for the inconvenience. Kindly send an email to SMT@aig.com about your policy, name and contact number. We will forward to the appropriate team. For privacy reasons, please do NOT post a response with your personal information.",h15061089068074196037
21,0,0,AIGinsurance,5/4/20,"@MrBRZ_Lomeli Hi, we are very sorry to hear of your frustration. Kindly send an email to SMT@aig.com about your policy, name and contact number. We will have someone look into your claim as soon as possible. For privacy reasons, please do NOT post a response with your personal information.",h6835414289486307849
22,0,0,AIGinsurance,5/5/20,"@kalinpearce Hi, Kalin. We are sorry to hear you feel this way. We aren’t able to know the details of your situation over social media, but please email your policy number and contact information to socialmedia@travelguard.com so that we can look into it. Thank you.",h16360572534415546389
23,0,0,AIGinsurance,5/5/20,"@limshadey Hello Mark, thank you for contacting us. Kindly send an email to SMT@aig.com with your policy, name and contact number. We will forward to the appropriate team. For privacy reasons, please do NOT post a response with your personal information.",h3333015745635548560
24,0,0,AIGinsurance,5/5/20,Learn more about AIG’s first quarter results on today’s webcast at 8am ET. Tune in here: https://t.co/VTmGN5xiKb,h15524214394126500973
25,0,0,AIGinsurance,5/6/20,We’re proud of the work our colleagues around the world do to foster #inclusion in the workplace and honored to have earned a spot on @DiversityInc's 2020 Top 50 Companies for Diversity list for the 3rd year in a row. 🏆 🙌 #LifeatAIG #DITop50 https://t.co/tpzkO5ljoI,h14208422261448396090
26,0,0,AIGinsurance,5/6/20,"@BMacintosh79 Hi Boris, We are sorry to hear of your frustration. If you have additional questions or concerns, please call 1-800-826-1300. Thank you",h18931744846733141
27,0,0,AIGinsurance,5/6/20,"Our thoughts remain with those affected by #COVID19, and we are committed to helping our global communities prepare for the challenges that lie ahead. https://t.co/PLFxgLbBLK",h6752612259481531218
28,0,0,AIGinsurance,5/6/20,"@LindsayMurphy11 Hi Linzi, we are sorry for the inconvenience. Kindly send an email to SMT@aig.com with your policy, name and phone number. We will have someone reach out to you as soon as possible. For privacy reasons, please do NOT post a response with your personal information.",h4870353437371448369
29,0,0,AIGinsurance,5/7/20,"@SheMeHerShan Hi, We apologize for the wait time. The claim review time can vary due to the complexity of a claim or receipt of all required documentation. If you need additional assistance please call 1-800-826-1300. Thank you.",h13832910228724150622
30,0,0,AIGinsurance,5/7/20,"@SheMeHerShan Hi, We apologize for the wait time since we are experiencing an extremely high volume of inquiries. You can check the status of your claim online at: https://t.co/mAm6G1CUPb. If you need additional assistance, please call 1-800-826-1300. Thank you.",h18097693219118192074
31,0,0,AIGinsurance,5/7/20,"@TheSquirrelyG Hi David, We are sorry to hear of your frustration. Please contact your claims adjuster or call us at 1-800-826-1300 so we can talk through it. Thank you",h7292504153590198046
32,0,0,AIGinsurance,5/7/20,"@ScarH5200 Hello, please email us at GCCU@aig.com so we can assist you with your claim.",h8902586877065062666
33,0,0,AIGinsurance,5/8/20,"@soundtwitts Hi, We apologize for the inconvenience. Please check our claims FAQ https://t.co/Lh0FTsimLK and you can file for a claim at https://t.co/48pYm5q4cV. Otherwise, email socialmedia@travelguard.com your policy no., full name, and phone so we can further assist. Thank you.",h3136188234657724904
34,0,0,AIGinsurance,5/8/20,"@_Giftayy Hi, We are sorry to hear of your feelings on this. If you have additional questions or concerns, please call us at 1-800-826-1300 so we can talk through it. Thank you",h5612201870806606300
35,0,0,AIGinsurance,5/8/20,"Mother's Day may be different this year, but that just gives us more reason to celebrate all the #supermoms out there. 🙌 🌟 🌷 #HappyMothersDay #LifeatAIG https://t.co/w60s5EyJ5f",h11927275874714541740
36,0,0,AIGinsurance,5/8/20,"@MrRizman Terima kasih atas komen anda. Untuk maklumat lanjut, sila emel GCCU@aig.com",h3143727073747891151
37,0,0,AIGinsurance,5/11/20,"@Robotastic Hi, We are sorry to hear of your frustration. Please check out our FAQs regarding COVID-19: https://t.co/LMCmYr8MqU. If you have additional questions or concerns, please call 1-800-826-1300. Thank you",h15810421441887529049
38,0,0,AIGinsurance,5/11/20,"@Justin_M_Ward Hi Justin, We apologize for the inconvenience. Please call 1-800-826-1300 or email socialmedia@travelguard.com your policy/claim number, email and phone number so we can assist. Thank you.",h17910534845042133267
39,0,0,AIGinsurance,5/11/20,"@BobbyJohnson Hi Bobby, We are sorry to hear of your frustration. Please check out our FAQs regarding COVID-19: https://t.co/JyA5W3aaH3. If you have additional questions or concerns, please call 1-800-826-1300. Thank you",h2331437286616867680
40,0,0,AIGinsurance,5/11/20,"@soundtwitts Hi, We are sorry to hear of your frustration. Please call 1-800-826-1300 or +1-715-295-1221 for assistance. Otherwise, email socialmedia@travelguard.com your policy no., full name, and phone so we can look into it. Thank you.",h10535058981009861502
41,0,0,AIGinsurance,5/11/20,"@gzones1974 We are happy to hear that, Jorge! We are glad that we could be of assistance to you.",h12713783843023131966
42,0,0,AIGinsurance,5/12/20,"@lt4kicks Hi, We apologize for the wait time since we're experiencing a high volume of inquiries. You can check the status of your claim online at: https://t.co/JDWvGyDdP6 or call 1-800-826-1300 if you need additional assistance. Thank you",h6942106529701876460
43,0,0,AIGinsurance,5/12/20,Times of crisis bring out scammers and fraudsters. AIG’s elder financial abuse expert Michele Kryger wants senior citizens to be alert to these top financial scams. https://t.co/deyf4qbyTW,h6988907971918898819
44,0,0,AIGinsurance,5/12/20,"@yoddeles Hello Yodd, we are sorry for the inconvenience. Kindly send an email to SMT@aig.com with your policy, claim number, name and phone number. We will have someone assist you as soon as possible. For privacy reasons, please do NOT post a response with your personal information.",h9840030496037290066
45,0,0,AIGinsurance,5/12/20,"@jonnsanta Hi John, We are a military friendly company and apologize for the wait time. Please have your son, the insured customer, email their full name, claim number, email and phone number to socialmedia@travelguard.com so we can look into it. Thank you.",h9158354352962346655
46,0,0,AIGinsurance,5/12/20,"@mdepta Hi Maggie, we’re sorry to hear of your frustration. Kindly send us an email at SMT@aig.com with your policy, claim number, name and phone number. For privacy reasons, please do NOT post a response with your personal information.",h14504840074750580531
47,0,0,AIGinsurance,5/13/20,"@Lissarette Hello Lissarette, we are sorry for the inconvenience. Kindly send an email to SMT@aig.com with your claim number, name and phone number. We will have someone assist you as soon as possible. For privacy reasons, please do NOT post a response with your personal information.",h8695338491414678327
48,0,0,AIGinsurance,5/13/20,"@bulletsandsteel Hi Patrick, Please check out our FAQs regarding COVID-19: https://t.co/cRJLKeVPLS. If you have additional questions or concerns, please call 1-800-826-1300. Thank you",h17882681229918526500
49,0,0,AIGinsurance,5/13/20,"@poojac1806 Hi Pooja, We are sorry to hear of your feelings on this. Please check out our FAQs regarding COVID-19: https://t.co/SveKVt0g0g. If you have additional questions or concerns, please call 1-800-826-1300. Thank you",h15155912360893492752
50,0,0,AIGinsurance,5/13/20,"@AntNikkii Hi, We are sorry to hear of your frustration. If you have additional questions or concerns, please call us at 1-800-826-1300 so we can talk through it. Thank you",h11794112529351153005
51,0,0,AIGinsurance,5/13/20,"@LenlynneBenson Hi Lynne, We apologize for the wait time since we are experiencing an extremely high volume of inquiries. You can check the status of your claim online at: https://t.co/GXoXY150VM. If you need additional assistance, please call 1-800-826-1300. Thank you.",h13737741189850297098
52,0,0,AIGinsurance,5/13/20,"@Korispeaks Hi Kori, We are sorry to hear of your frustration. If you have additional questions or concerns, please call 1-800-826-1300. Thank you",h18359955847837464549
53,0,0,AIGinsurance,5/13/20,"@UltimateBeing01 Hi Christopher, We are sorry to hear of your feelings on this. If you have additional questions or concerns, please call 1-800-826-1300. Thank you",h8895391392936384668
54,0,0,AIGinsurance,5/13/20,"@CMcgreivy Hello Conor, please email us at GCCU@aig.com if you have any questions regarding your quote.",h14874574667180153727
55,0,0,AIGinsurance,5/13/20,"@SpeechChief Hello James, we are sorry to hear of your frustration. Kindly send an email to SMT@aig.com about your policy, name and contact number. We will have someone look into your claim as soon as possible. For privacy reasons, please do NOT post a response with your personal information.",h16524893762355673168
56,0,0,AIGinsurance,5/13/20,"@organicscausa Hi, We apologize for the wait time. Please call 1-800-826-1300 or email your phone and email address to socialmedia@travelguard.com and we would be happy to pass your inquiry along to the claims department to further assist. Thank you.",h8447286092317742880
57,0,0,AIGinsurance,5/14/20,"@noorulainy_ Hi Noor, We are sorry to hear of your frustration. Please call 1-800-826-1300 for further assistance. Thank you",h17385521789309355393
58,0,0,AIGinsurance,5/14/20,"@JenniferChasse Hi Jennifer, We are sorry to hear of your frustration. If you have additional questions or concerns, please call 1-800-826-1300. Thank you",h6452550426235397655
59,0,0,AIGinsurance,5/14/20,"@onceuponasquat Hi, We apologize for the inconvenience. Please check the status of your claim online at: https://t.co/YCfpwgjDdA. If you need additional assistance, please contact us at 1-800-826-1300 or socialmedia@travelguard.com. Thank you.",h7499399693164334040
60,0,0,AIGinsurance,5/14/20,"@NPapukchiev Hello Nikolay, we are sorry for the inconvenience. Kindly send an email to SMT@aig.com with your policy, concern, name and phone number. We will have someone assist you as soon as possible. For privacy reasons, please do NOT post a response with your personal information.",h1641023761657761140
61,0,0,AIGinsurance,5/14/20,Congratulations to AIG’s Anna Rozin for winning Business Insurance’s 2020 Break Out Award and being recognized as an outstanding performer in risk management and the property/casualty insurance field. 🙌 🏆,h11195528387577335940
62,0,0,AIGinsurance,5/14/20,"@PiTaBit Hi, We are sorry to hear of your feelings on this. If you have additional questions or concerns, please call 1-800-826-1300. Thank you",h8062575221261693533
63,0,0,AIGinsurance,5/14/20,"@soundtwitts Hi, Please visit the AIG Ireland Claims information site at https://t.co/AB0rjt3d31 or call 01 6619133 for assistance with your claim. Thank you",h2579062800068459689
64,0,0,AIGinsurance,5/14/20,"@EmenAndres Hi Andres, We are sorry to hear of your frustration. If you have additional questions or concerns, please call 1-800-826-1300. Thank you",h10782860883231732469
65,0,0,AIGinsurance,5/14/20,"@ShannonDRinella Hi Shannon, Please check out our claims FAQ https://t.co/m8L7WOxeV4 and you can view the status of your claim online at: https://t.co/Cb3FD1IwOc. If you need additional assistance, please call 1-800-826-1300. Thank you.",h3191687334309188360
66,0,0,AIGinsurance,5/15/20,"@21stParallel Hi, We are sorry to hear of your frustration. If you have any additional questions or concerns, please call us at 1-800-826-1300 so we can talk through it. Thank you",h10643102776672917027
67,0,0,AIGinsurance,5/15/20,"@DemitriTarabini Hi Demitri, To submit a request for a travel insurance premium refund or voucher please visit: https://t.co/ZhYiIMLMDH. If you need additional assistance, please call 1-800-826-1300. Thank you.",h12221926707366159955
68,0,0,AIGinsurance,5/15/20,"@roykrauthamer Hello Roy, we are sorry for the inconvenience. Kindly send an email to SMT@aig.com with your name, policy, claim, and phone number. We will have someone assist you as soon as possible. For privacy reasons, please do NOT post a response with your personal information.",h14005108933906994425
69,0,0,AIGinsurance,5/15/20,"@SHarbour Hi Sue, We are sorry to hear of your feelings on this. To submit a request for a travel insurance premium refund or voucher please visit: https://t.co/Zus8pL090a. If you need additional assistance, please call 1-800-826-1300. Thank you.",h4865943639672861392
70,0,0,AIGinsurance,5/15/20,"@DrShantella Hi Dr. Sherman, We are sorry to hear of your frustration. If you have additional questions or concerns, please call 1-800-826-1300. Thank you",h12003357927799980358
71,0,0,AIGinsurance,5/15/20,"@JDVisMe Hi Jill, Documentation is requested if necessary to make coverage decisions under the terms and conditions of the policy. If you have any additional questions or concerns, please contact your claims agent or contact us at 1-800-826-1300 or socialmedia@travelguard.com. Thank you",h2302352838105596945
72,0,0,AIGinsurance,5/18/20,"@TheMouseArtist Hi, We apologize for the wait time since we are experiencing an extremely high volume of inquiries. You can check the status of your claim online at: https://t.co/z11bakE0BH. If you need additional assistance, please call 1-800-826-1300. Thank you.",h14697728968739538562
73,0,0,AIGinsurance,5/18/20,"@leah_freem Hi, We apologize for the wait time since we are experiencing an extremely high volume of inquiries. You can check the status of your claim online at: https://t.co/aRqx7IZCNQ. If you need additional assistance, please call 1-800-826-1300. Thank you.",h6986516253957454449
74,0,0,AIGinsurance,5/18/20,"@clydekati Hi Clyde, Please visit our website to modify your travel insurance policy: https://t.co/NFwAatQxMi. If you need additional assistance, please contact us at 1-800-826-1300 or socialmedia@travelguard.com. Thank you.",h15360938360109158512
75,0,0,AIGinsurance,5/18/20,"@ConLaw60654 Hi, We are sorry to hear of your feelings on this. If you have additional questions or concerns, please call 1-800-826-1300. Thank you",h8166019919991265241
76,0,0,AIGinsurance,5/18/20,"@antoinetttteeee Hi, We are sorry to hear of your feelings on this. Please check out our FAQs regarding COVID-19: https://t.co/KheeGnlp65 and if you have additional questions or concerns, please call 1-800-826-1300. Thank you",h6847617120829440473
77,0,0,AIGinsurance,5/18/20,"@RaeAnnEmerySAG Hi RaeAnn, We apologize for the wait time since we are experiencing an extremely high volume of inquiries. You can check the status of your claim online at: https://t.co/IvM8a1dB8l. If you need additional assistance, please call 1-800-826-1300. Thank you.",h11510551355816740267
78,0,0,AIGinsurance,5/18/20,"@cruzmartin Hi Martin, We apologize for the wait time since we are experiencing an extremely high volume of inquiries. You can check the status of your claim online at: https://t.co/Erv9DzANpO. If you need additional assistance, please call 1-800-826-1300. Thank you.",h5234744771839306342
79,0,0,AIGinsurance,5/18/20,AIG Life Insurance CEO Adam Winslow answers common questions about how #lifeinsurance and financial professionals can help their clients protect themselves and loved ones in this time of uncertainty.,h1175443591182733054
80,0,0,AIGinsurance,5/18/20,"@TinkerpussBCcat Hello, please email us at GCCU@aig.com so we can assist you.",h11905212400983115488
81,0,0,AIGinsurance,5/18/20,"@jayquellz Hello, please email us at GCCU@aig.com so we can assist you with your claim.",h13303463877515929541
82,0,0,AIGinsurance,5/18/20,"@EmenAndres Hi Andres, Please call 1-800-826-1300 or email socialmedia@travelguard.com your concerns. For privacy reasons, we recommend you delete your claim number and please do NOT post a response with your personal information. Thank you",h12990759484661846308
83,0,0,AIGinsurance,5/18/20,"@StandUpRecords Hi, We are sorry to hear of your frustration. If you have additional questions or concerns, please call 1-800-826-1300. Thank you",h1191505408183357502
84,0,0,AIGinsurance,5/18/20,"@srilankanmafia Hi Michelle, We apologize for the wait time since we are experiencing an extremely high volume of inquiries. You can check the status of your claim online at: https://t.co/u91qB2F84z. If you need additional assistance, please call 1-800-826-1300. Thank you.",h3591061244389656291
85,0,0,AIGinsurance,5/18/20,"@zakfener1907 Hi, We apologize for the wait time since we are experiencing an extremely high volume of inquiries. You can check the status of your claim online at: https://t.co/sGR0cAmbYi. If you need additional assistance, please call 1-800-826-1300. Thank you.",h7917307553181018788
86,0,0,AIGinsurance,5/18/20,"@saur008 Hello, please email us at GCCU@aig.com so we can assist you with your claim.",h3593419048412865910
87,0,0,AIGinsurance,5/18/20,"@Increbelle1 Hello, we are sorry to hear of your frustration. Kindly send an email to SMT@aig.com with your name, policy, claim, and phone number. We will have someone assist you as soon as possible. For privacy reasons, please do NOT post a response with your personal information.",h15165994559505756613
88,0,0,AIGinsurance,5/18/20,"@0619tdawg Hello Tony, we are sorry to hear of your frustration. Kindly send an email to SMT@aig.com about your policy, name and contact number. We will have someone look into your claim as soon as possible. For privacy reasons, please do NOT post a response with your personal information.",h9937202697580475938
89,0,0,AIGinsurance,5/18/20,"@ReisaMiller Hello Reisa, we are sorry for the inconvenience. Kindly send an email to SMT@aig.com about your policy, name and contact number. We will have someone look into your claim as soon as possible. For privacy reasons, please do NOT post a response with your personal information.",h7631265062931421239
90,0,0,AIGinsurance,5/19/20,"@kodaksnaccc We apologize for the wait time. You can check the status of your claim online: https://t.co/ytzzpqlA7O. We know the process can be tedious, but our due diligence is necessary while evaluating each claim.  If you need additional assistance, please call 1-800-826-1300. Thank you.",h16427816238483067430
91,0,0,AIGinsurance,5/19/20,"@murmac99 Hi, Murray. We apologize for the wait time. You can check the status of your claim online: https://t.co/SgXrRsc2O1. We know the process can be tedious, but our due diligence is necessary while evaluating each claim.  If you need additional assistance, please call 1-800-826-1300.",h3752291145017905000
92,0,0,AIGinsurance,5/19/20,"@leah_freem Hi, Leah. We apologize for the wait time. We know the process can be tedious, but our due diligence is necessary while evaluating each claim. You can check the status of your claim at: https://t.co/6STBF7nHc2. For additional assistance, please call 1-800-826-1300. Thank you.",h7193172645147467961
93,0,0,AIGinsurance,5/19/20,"@luvpink4476 Hello Ash, we are sorry to hear of your frustration. Kindly send an email to SMT@aig.com about your policy, name and contact number. We will have someone look into your claim as soon as possible. For privacy reasons, please do NOT post a response with your personal information.",h10147408832294939756
